
10:08:57.021934 IP 58.67.160.246.9900 > 192.168.5.171.50289: Flags [F.], seq 1, ack 891, win 156, length 0
E..(%.@.2...:C......&..q...H..r8P.......
10:08:57.435734 IP 58.67.160.246.9900 > 192.168.5.171.50289: Flags [F.], seq 1, ack 891, win 156, length 0
E..(%.@.2...:C......&..q...H..r8P.......
10:08:57.474210 IP 192.168.5.171.50289 > 58.67.160.246.9900: Flags [.], ack 2, win 229, length 0
E..(%.@.@.t8....:C...q&...r8...IP....9........
10:08:57.474662 IP 192.168.5.171.50289 > 58.67.160.246.9900: Flags [F.], seq 891, ack 2, win 229, length 0
E..(%.@.@.t7....:C...q&...r8...IP....8........
10:08:57.481631 IP 58.67.160.246.9900 > 192.168.5.171.50289: Flags [.], ack 892, win 156, length 0
E..(..@.2..C:C......&..q...I..r9P.......
10:08:57.561339 IP 192.168.5.171.47259 > 58.67.160.246.9000: Flags [.], ack 1226, win 267, options [nop,nop,TS val 8305010 ecr 1
E..4L]@.@.L.....:C....#(............au.....
.~.r.8.H
10:08:57.707119 IP 192.168.5.171.47259 > 58.67.160.246.9000: Flags [.], ack 1227, win 267, options [nop,nop,TS val 8305040 ecr 1
E..4L^@.@.L.....:C....#(............aP.....
.~...8.N
10:08:57.742963 IP 192.168.5.171.50289 > 58.67.160.246.9900: Flags [F.], seq 891, ack 2, win 229, length 0
E..(%^M@.@.t6....:C...q&...r8...IP....8........
10:08:57.750794 IP 58.67.160.246.9900 > 192.168.5.171.50289: Flags [.], ack 892, win 156, length 0
E..(..@.2..C:C......&..q...I..r9P.......
10:08:57.766985 IP 192.168.5.171.50289 > 58.67.160.246.9900: Flags [.], ack 2, win 229, options [nop,nop,sack 1 {1:2}], length 0
E..4%.@.@.t)....:C...q&...r9...I....C......
...H...I
10:08:57.770177 IP 192.168.5.171.50289 > 58.67.160.246.9900: Flags [R], seq 2768728633, win 0, length 0
E..(..@.@..C....:C...q&...r9....P.............

